{
  "vendorName": "accelink",
  "productType": "O2-F-1",
  "yangModel": "ByteDance",
  "nodeType": "OD",
  "cardClass": [
    {
      "name": "MUXPANEL",
      "card": [
        {
          "cardType": "MUXPANEL_32C32L",
          "vendorType": "MUXPANEL_32C32L",
          "wdmBand": "C+L",
          "width": 1,
          "height": 1,
          "possibleSlot": [
            50,
            51
          ],
          "ports": [
            {
              "name": "MUX",
              "portType": "MUX-MUX",
              "supportedSignal": [],
              "biDirection": true,
              "index": "0"
            },
            {
              "name": "M?D?,1,64,1",
              "portType": "MUX-Channel",
              "supportedSignal": [
                "OCH"
              ],
              "biDirection": true,
              "index": "?,5,69,1"
            },
            {
              "name": "MPO?,1,4,1",
              "portType": "OPC-MPO",
              "supportedSignal": [
                "OMS"
              ],
              "biDirection": true,
              "adminEnable": true,
              "index": "?,1,4,1"
            },
            {
              "name": "AUX",
              "portType": "Other",
              "supportedSignal": [
                "OMS"
              ],
              "biDirection": true,
              "index": "70"
            }
          ],
          "internalLinks": [
            {
              "biDirection": true,
              "from": "M?D?,1,8,1",
              "to": "MPO1"
            },
            {
              "biDirection": true,
              "from": "M?D?,33,40,1",
              "to": "MPO1"
            },
            {
              "biDirection": true,
              "from": "M?D?,9,16,1",
              "to": "MPO2"
            },
            {
              "biDirection": true,
              "from": "M?D?,41,48,1",
              "to": "MPO2"
            },
            {
              "biDirection": true,
              "from": "M?D?,17,24,1",
              "to": "MPO3"
            },
            {
              "biDirection": true,
              "from": "M?D?,49,56,1",
              "to": "MPO3"
            },
            {
              "biDirection": true,
              "from": "M?D?,25,32,1",
              "to": "MPO4"
            },
            {
              "biDirection": true,
              "from": "M?D?,57,64,1",
              "to": "MPO4"
            }
          ],
          "externalLinks": [
            {
              "biDirection": true,
              "multiple": 3,
              "from": "MPO?,1,3,1",
              "to": [
                {
                  "cardType": "IRA_CL",
                  "port": "MPO?,1,3,1"
                }
              ]
            },
            {
              "initiated": false,
              "biDirection": true,
              "from": "MPO4",
              "multiple": 8,
              "mdPort": "M?D?,25,32,1",
              "to": [
                {
                  "cardType": "IRA_CL",
                  "port": "EXP?,1,8,1"
                }
              ]
            },
            {
              "initiated": false,
              "biDirection": true,
              "from": "MPO4",
              "multiple": 8,
              "mdPort": "M?D?,57,64,1",
              "to": [
                {
                  "cardType": "IRA_CL",
                  "port": "EXP?,1,8,1"
                }
              ]
            }
          ],
          "externalCrossConnections": [
            {
              "initiated": false,
              "isFixed": false,
              "type": "OCH",
              "biDirection": true,
              "multiple": 64,
              "description": "MUXPANEL-1-<slot>-<from>/<central-frequency>",
              "from": {
                "port": "M?D?,1,64,1"
              },
              "to": {
                "cardType": "IRA_CL",
                "port": "LINE"
              },
              "wssChannel": {
                "voaUpdateModel": "Manually",
                "sourceToDestVoa": 3.00,
                "destToSourceVoa": 3.00,
                "lowerFrequency": "<lower-frequency>",
                "upperFrequency": "<upper-frequency>",
                "params": [
                  {
                    "name": "ase-control-mode",
                    "value": "ASE_AUTO"
                  },
                  {
                    "name": "ase-injection-threshold",
                    "value": "-10.00"
                  },
                  {
                    "name": "source-to-dest-power-control-mode",
                    "value": "APC"
                  },
                  {
                    "name": "auto-control-active-threshold-dest",
                    "value": "0.5"
                  },
                  {
                    "name": "auto-control-range",
                    "value": "6"
                  },
                  {
                    "name": "slice-type",
                    "value": "NORMAL"
                  }
                ]
              }
            }
          ]
        }
      ]
    },
    {
      "name": "IRA",
      "card": [
        {
          "cardType": "IRA_CL",
          "vendorType": "IRA_CL",
          "wdmBand": "C+L",
          "width": 4,
          "height": 1,
          "possibleSlot": [
            1,
            5
          ],
          "ports": [
            {
              "name": "MPO?,1,3,1",
              "portType": "WSS-Mesh",
              "supportedSignal": [
                "OMS"
              ],
              "biDirection": true,
              "adminEnable": true,
              "index": "?,3,5,1"
            },
            {
              "name": "LINE",
              "portType": "OA-Line",
              "transceiver": {
                "name": "TRANSCEIVER?OSC",
                "initiated": true
              },
              "supportedSignal": [
                "OTS"
              ],
              "biDirection": true,
              "adminEnable": true,
              "index": "0"
            },
            {
              "name": "SIG",
              "portType": "OA-Sig",
              "transceiver": {
                "name": "TRANSCEIVER?OSC",
                "initiated": true
              },
              "supportedSignal": [
                "OTS"
              ],
              "biDirection": true,
              "adminEnable": true,
              "index": "1"
            },
            {
              "name": "AUX",
              "portType": "Other",
              "supportedSignal": [
                "OMS"
              ],
              "biDirection": true,
              "index": "15"
            },
            {
              "name": "EXP?,1,8,1",
              "portType": "WSS-Mesh",
              "supportedSignal": [
                "OMS"
              ],
              "biDirection": true,
              "index": "?,6,13,1"
            },
            {
              "name": "EXP33",
              "portType": "WSS-Sig",
              "supportedSignal": [
                "OMS"
              ],
              "biDirection": true,
              "adminEnable": true,
              "index": "2"
            },
            {
              "name": "MF",
              "portType": "Other",
              "supportedSignal": [
                "OMS"
              ],
              "biDirection": true,
              "index": "14"
            }
          ],
          "externalLinks": [
            {
              "biDirection": true,
              "multiple": 3,
              "from": "MPO?,1,3,1",
              "to": [
                {
                  "cardType": "MUXPANEL_32C32L",
                  "port": "MPO?,1,3,1"
                }
              ]
            },
            {
              "biDirection": true,
              "from": "LINE",
              "to": [
                {
                  "neType": "OD",
                  "cardType": "IRA_CL",
                  "port": "LINE"
                },
                {
                  "neType": "OD",
                  "cardType": "OLP3_3",
                  "port": "?SIG,1,3,1"
                },
                {
                  "neType": "OD",
                  "cardType": "ILA_CL",
                  "port": "LINE_WEST"
                },
                {
                  "neType": "OD",
                  "cardType": "DGE_CL",
                  "port": "LINE_WEST"
                }
              ]
            },
            {
              "initiated": false,
              "biDirection": true,
              "from": "EXP1",
              "to": [
                {
                  "cardType": "IRA_CL",
                  "port": "EXP1"
                }
              ]
            },
            {
              "initiated": false,
              "biDirection": true,
              "multiple": 8,
              "from": "EXP?,1,8,1",
              "to": [
                {
                  "cardType": "MUXPANEL_32C32L",
                  "port": "MPO4"
                }
              ]
            }
          ],
          "crossConnections": [
            {
              "initiated": true,
              "type": "BA",
              "biDirection": false,
              "description": "AMPLIFIER-1-<slot>-BAC",
              "from": {
                "port": "SIG",
                "layer": "C"
              },
              "to": {
                "port": "LINE",
                "layer": "C"
              },
              "amplifier": {
                "params": [
                  {
                    "name": "ase-injection",
                    "value": "NONE"
                  },
                  {
                    "name": "loss-shutdown-hold-off-time",
                    "value": "0"
                  }
                ]
              }
            },
            {
              "initiated": true,
              "type": "PA",
              "biDirection": false,